{
  "$schema": "http://json-schema.org/draft-07/schema#",
  "title": "VDX Design Theme",
  "type": "object",
  "required": ["id", "name", "version", "colors", "typography", "spacing", "radius", "shadow", "motion", "breakpoints", "components"],
  "additionalProperties": false,
  "properties": {
    "id": { "type": "string", "pattern": "^[a-z0-9][a-z0-9-]*$" },
    "name": { "type": "string", "minLength": 1 },
    "version": { "type": "string", "pattern": "^\\d+\\.\\d+\\.\\d+$" },
    "description": { "type": "string" },
    "defaultLang": { "type": "string", "pattern": "^[a-zA-Z]{2,3}(-[a-zA-Z]{2,4})?$" },
    "colors": {
      "type": "object",
      "required": ["brand", "neutral", "semantic", "surface", "text", "border"],
      "additionalProperties": false,
      "properties": {
        "brand": {
          "type": "object",
          "required": ["primary", "primaryHover", "secondary", "accent"],
          "additionalProperties": false,
          "properties": {
            "primary": { "$ref": "#/definitions/color" },
            "primaryHover": { "$ref": "#/definitions/color" },
            "secondary": { "$ref": "#/definitions/color" },
            "accent": { "$ref": "#/definitions/color" }
          }
        },
        "neutral": {
          "type": "object",
          "required": ["0", "50", "100", "200", "300", "500", "700", "900", "1000"],
          "additionalProperties": false,
          "patternProperties": { "^[0-9]+$": { "$ref": "#/definitions/color" } }
        },
        "semantic": {
          "type": "object",
          "required": ["success", "warning", "danger", "info"],
          "additionalProperties": false,
          "properties": {
            "success": { "$ref": "#/definitions/color" },
            "warning": { "$ref": "#/definitions/color" },
            "danger": { "$ref": "#/definitions/color" },
            "info": { "$ref": "#/definitions/color" }
          }
        },
        "surface": {
          "type": "object",
          "required": ["page", "card", "elevated", "inverse"],
          "additionalProperties": false,
          "properties": {
            "page": { "$ref": "#/definitions/color" },
            "card": { "$ref": "#/definitions/color" },
            "elevated": { "$ref": "#/definitions/color" },
            "inverse": { "$ref": "#/definitions/color" }
          }
        },
        "text": {
          "type": "object",
          "required": ["primary", "secondary", "muted", "onBrand", "onInverse"],
          "additionalProperties": false,
          "properties": {
            "primary": { "$ref": "#/definitions/color" },
            "secondary": { "$ref": "#/definitions/color" },
            "muted": { "$ref": "#/definitions/color" },
            "onBrand": { "$ref": "#/definitions/color" },
            "onInverse": { "$ref": "#/definitions/color" },
            "onInverseSecondary": { "$ref": "#/definitions/color" }
          }
        },
        "border": {
          "type": "object",
          "required": ["subtle", "default", "strong", "inverse"],
          "additionalProperties": false,
          "properties": {
            "subtle": { "$ref": "#/definitions/color" },
            "default": { "$ref": "#/definitions/color" },
            "strong": { "$ref": "#/definitions/color" },
            "inverse": { "$ref": "#/definitions/color" }
          }
        },
        "swatch": {
          "type": "object",
          "additionalProperties": false,
          "patternProperties": { "^[a-zA-Z][a-zA-Z0-9]*$": { "$ref": "#/definitions/color" } }
        }
      }
    },
    "typography": {
      "type": "object",
      "required": ["fontFamily", "fontSize", "lineHeight", "fontWeight", "letterSpacing"],
      "additionalProperties": false,
      "properties": {
        "fontFamily": {
          "type": "object",
          "required": ["sans", "display", "mono"],
          "additionalProperties": false,
          "properties": {
            "sans": { "$ref": "#/definitions/cssSafeString" },
            "display": { "$ref": "#/definitions/cssSafeString" },
            "mono": { "$ref": "#/definitions/cssSafeString" }
          }
        },
        "fontSize": {
          "type": "object",
          "required": ["caption", "bodyS", "bodyM", "bodyL", "h4", "h3", "h2", "h1", "displayM", "displayL", "displayXL"],
          "additionalProperties": false,
          "patternProperties": { "^[a-zA-Z][a-zA-Z0-9]*$": { "$ref": "#/definitions/length" } }
        },
        "lineHeight": {
          "type": "object",
          "required": ["tight", "normal", "relaxed"],
          "additionalProperties": false,
          "patternProperties": { "^[a-zA-Z][a-zA-Z0-9]*$": { "$ref": "#/definitions/cssSafeString" } }
        },
        "fontWeight": {
          "type": "object",
          "required": ["regular", "medium", "semibold", "bold"],
          "additionalProperties": false,
          "patternProperties": { "^[a-zA-Z][a-zA-Z0-9]*$": { "$ref": "#/definitions/fontWeight" } }
        },
        "letterSpacing": {
          "type": "object",
          "required": ["tight", "normal", "wide"],
          "additionalProperties": false,
          "patternProperties": { "^[a-zA-Z][a-zA-Z0-9]*$": { "$ref": "#/definitions/cssSafeString" } }
        }
      }
    },
    "spacing": {
      "type": "object",
      "required": ["0", "1", "2", "3", "4", "5", "6", "8", "10", "12", "16", "20", "24"],
      "additionalProperties": false,
      "patternProperties": { "^[0-9]+$": { "$ref": "#/definitions/length" } }
    },
    "radius": {
      "type": "object",
      "required": ["none", "sm", "md", "lg", "pill"],
      "additionalProperties": false,
      "patternProperties": { "^[a-zA-Z][a-zA-Z0-9]*$": { "$ref": "#/definitions/length" } }
    },
    "shadow": {
      "type": "object",
      "required": ["none", "sm", "md", "lg"],
      "additionalProperties": false,
      "patternProperties": { "^[a-zA-Z][a-zA-Z0-9]*$": { "$ref": "#/definitions/cssSafeString" } }
    },
    "motion": {
      "type": "object",
      "required": ["duration", "easing"],
      "additionalProperties": false,
      "properties": {
        "duration": {
          "type": "object",
          "required": ["fast", "base", "slow"],
          "additionalProperties": false,
          "patternProperties": { "^[a-zA-Z][a-zA-Z0-9]*$": { "$ref": "#/definitions/duration" } }
        },
        "easing": {
          "type": "object",
          "required": ["standard", "emphasized"],
          "additionalProperties": false,
          "patternProperties": { "^[a-zA-Z][a-zA-Z0-9]*$": { "$ref": "#/definitions/cssSafeString" } }
        }
      }
    },
    "breakpoints": {
      "type": "object",
      "required": ["mobile", "tablet", "laptop", "desktop", "xl"],
      "additionalProperties": false,
      "patternProperties": { "^[a-zA-Z][a-zA-Z0-9]*$": { "$ref": "#/definitions/length" } }
    },
    "layout": {
      "type": "object",
      "additionalProperties": false,
      "patternProperties": { "^[a-zA-Z][a-zA-Z0-9]*$": { "$ref": "#/definitions/length" } }
    },
    "components": {
      "type": "object",
      "required": ["button", "input", "card", "nav", "footer"],
      "additionalProperties": false,
      "properties": {
        "button": {
          "type": "object",
          "required": ["height", "paddingX", "radius", "fontWeight"],
          "additionalProperties": false,
          "properties": {
            "height": { "$ref": "#/definitions/length" },
            "paddingX": { "$ref": "#/definitions/length" },
            "radius": { "$ref": "#/definitions/length" },
            "fontWeight": { "$ref": "#/definitions/fontWeight" }
          }
        },
        "input": {
          "type": "object",
          "required": ["height", "paddingX", "radius", "borderColor"],
          "additionalProperties": false,
          "properties": {
            "height": { "$ref": "#/definitions/length" },
            "paddingX": { "$ref": "#/definitions/length" },
            "radius": { "$ref": "#/definitions/length" },
            "borderColor": { "$ref": "#/definitions/color" }
          }
        },
        "card": {
          "type": "object",
          "required": ["padding", "radius", "shadow"],
          "additionalProperties": false,
          "properties": {
            "padding": { "$ref": "#/definitions/length" },
            "radius": { "$ref": "#/definitions/length" },
            "shadow": { "$ref": "#/definitions/cssSafeString" }
          }
        },
        "nav": {
          "type": "object",
          "required": ["height", "background", "color"],
          "additionalProperties": false,
          "properties": {
            "height": { "$ref": "#/definitions/length" },
            "background": { "$ref": "#/definitions/color" },
            "color": { "$ref": "#/definitions/color" }
          }
        },
        "footer": {
          "type": "object",
          "required": ["background", "color"],
          "additionalProperties": false,
          "properties": {
            "background": { "$ref": "#/definitions/color" },
            "color": { "$ref": "#/definitions/color" }
          }
        }
      }
    }
  },
  "definitions": {
    "color": {
      "type": "string",
      "pattern": "^(#([0-9a-fA-F]{3}|[0-9a-fA-F]{4}|[0-9a-fA-F]{6}|[0-9a-fA-F]{8})|rgb\\(\\s*\\d{1,3}\\s*,\\s*\\d{1,3}\\s*,\\s*\\d{1,3}\\s*\\)|rgba\\(\\s*\\d{1,3}\\s*,\\s*\\d{1,3}\\s*,\\s*\\d{1,3}\\s*,\\s*(0|1|0?\\.\\d+)\\s*\\)|hsl\\(\\s*\\d{1,3}(\\.\\d+)?\\s*,\\s*\\d{1,3}(\\.\\d+)?%\\s*,\\s*\\d{1,3}(\\.\\d+)?%\\s*\\)|hsla\\(\\s*\\d{1,3}(\\.\\d+)?\\s*,\\s*\\d{1,3}(\\.\\d+)?%\\s*,\\s*\\d{1,3}(\\.\\d+)?%\\s*,\\s*(0|1|0?\\.\\d+)\\s*\\)|transparent|currentColor|black|white|red|green|blue|yellow|orange|purple|gray|grey)$"
    },
    "length": {
      "type": "string",
      "description": "A CSS length / size value. Accepts an integer or decimal in the listed units, plus the four CSS math functions whose body is constrained by the cssSafeString charset. Rejects leading zeros (00px), bare numbers (5), unknown units, and negative-zero forms (-0px, -0.0px) since the sign on a zero magnitude is meaningless.",
      "pattern": "^(0|-?([1-9]\\d*(\\.\\d+)?|0?\\.\\d*[1-9]\\d*)(px|rem|em|%|vh|vw|svh|lvh|dvh|svw|lvw|dvw|ch|cqw|cqh|cqi|cqb|cqmin|cqmax|pt|pc)|(calc|clamp|min|max)\\([^;{}<>\\n\\r]*[^;{}<>\\n\\r\\s][^;{}<>\\n\\r]*\\))$"
    },
    "duration": {
      "type": "string",
      "pattern": "^\\d+(\\.\\d+)?m?s$"
    },
    "fontWeight": {
      "type": "string",
      "pattern": "^(100|200|300|400|500|600|700|800|900|normal|bold|lighter|bolder)$"
    },
    "cssSafeString": {
      "type": "string",
      "minLength": 1,
      "pattern": "^[^;{}<>\\n\\r]+$"
    }
  }
}
